jobTitle,companyName,location,datePosted,appStatus,description,seniorityLevel,employmentType,jobFunction,industries
Credit Control Assistant,"Church & Dwight Co., Inc.",Russia,2021-09-25,< 25 applicants,collective energy ambition place make real difference company genuinely cares people products consumers environment unique informal culture champions courage determination collaboration knowing open supportive team means us freedom take responsibility ownership shared passion work hard innovate push boundaries united belief strive growth anything possible might largest company industry believe biggest impact together power win recruiting credit control assistant permanent basis support finance department based corporate office folkestone kent regular duties include allocation sales ledger payments received clients cheque electronic payment reconciliation customer accounts recording cheques received preparation documentation relating banking cheques obtaining customer credit debit notes responding queries concerning accounts receivable satisfying requests copy invoices passing queries concerning price short delivery sales department recording queries spreadsheet keeping track queries resolution issue monthly customer statements production credit notes invoices relating items sale goods chasing debt via referring difficult cases credit manager assist preparation schedule promotional accruals assist cover credit control manager absent office reconciliation customer cash discounts assist credit limit credit term changes required general filing correspondence required work week monday thursday 9am 5pm friday 9am return offer competitive package including 24 days annual leave pension matched 9 discretionary annual bonus membership health cash plan information company brands culture visit us http applying role sending cv understand company hold personal data relation prospective employment process data legitimate business reasons within requirements uk data protection laws currently effect become applicable including data protection act 1998 general data protection regulation regulation eu successor legislation candidate privacy notice,Director,Full-time,Accounting/Auditing and Finance,"Food & Beverages, Consumer Goods, and Pharmaceuticals"
Federal Practice - Director of Capture Management/Business Development,"BroadPoint Federal, Inc.",Russia,2021-09-09,< 25 applicants,overview broadpoint federal delivers quality solutions designed specifically government organizations areas enterprise resource planning well case business process management looking experienced creative federal capture professional lead federal sales efforts specifically broadpoint implements oracle suite erp applications microsoft dynamics entellitrak case management solution clients civilian sector responsibilities looking someone combination business development bd capture proposal management experience serve army one leading complex high priority business opportunities federal space assesses opportunity identify resources needed pursue opportunity meet clients build relationships key partners develop winning bid strategies pricing teaming proposal strategy looking someone entrepreneurial drive excitement make direct contribution growth dynamic small business working across company alongside motivated colleagues responsible full lifecycle capture management opportunity assessment proposal execution qualify opportunities based company criteria priorities identify opportunities agency research 3rd party market intelligence tools client partner networks perform gate reviews bid decisions per corporate process guidelines coordinate drive phases capture activities strategy execution meet customer stakeholders understand business needs position broadpoint federal preferred contractor lead win strategy including win themes competitive assessment pricing strategy discussion strategic action plans rois risk assessment communicate overall capture progress management lead responses requests information provide market analysis competitor analysis gap analysis teaming advice help negotiate partnership teams prepare input ndas tas working finance prepare deliver update senior leadership specified milestones capture process gate review fully support proposal development process including strategy themes solutions writing schedules staffing pricing past performance resumes proposal actions ensure capture team strategy themes solution discriminators reflected proposal support transition transfer capture responsibility knowledge operations team upon contract award utilize bd market intelligence accounts subscriptions oversee pipeline right candidate qualifications bachelors degree business must least 5 years experience business development capture ideally projects civilian public sector space demonstrated success identifying initiating nurturing new ongoing business opportunities demonstrated record successful capture proposal strategy execution strong communication skills including verbal presentation skills individuals groups internally externally strong writing skills include development content incorporating key win themes clear concise manner superior proficiency microsoft office professional suite word powerpoint excel etc working primarily remotely option perform job successfully individual must able perform essential duty satisfactorily requirements listed representative knowledge skill ability required reasonable accommodations may made enable individuals disabilities perform essential functions,Director,Full-time,Business Development and Sales,"Information Technology and Services, Computer Software, and Management Consulting"
Technical Service Manager (Application Management),Netcracker Technology,Russia,2021-09-11,< 25 applicants,since 1993 netcracker technology developing implementing unique solutions 250 customers worldwide mostly telecom providers create dozens innovative products lead global market solutions ready used cloud environment comprehensive portfolio software solutions professional services enables digital transformations unlocking cloud opportunities virtualization changing mobile ecosystem currently looking technical service manager application management join team work design development customization solutions telecom companies implement support innovative technologies 5g esim internet access satellites low earth orbit iot etc get unlimited opportunities professional career development global company design develop manage solution management process based customer specifics requirements support business user groups involved process work critical high severity incidents problems identify root causes provide appropriate solutions sufficient technical expertise provide timely status updates reports higher management level plan manage application support team allocate resources distribute tasks within team control results manage deliver service functional change requests keep responsibility e2e relations client service regards production application crm billing order management service assurance etc residential business customers manage internal external communications carry regular meetings phone calls conferences presentations one key team leads telecom business transformation programs providing wide range services application support hosted remote managed services specialized services set manage operations phase secure operational readiness prior start application commercial usage plan budget resources post production support phase keep project within allocated budget find resources execute time budget without compromising quality upsell software changes professional services participate support maintenance sales cycle meet customer management support representatives create presentations work requests proposal evaluate resources costs support services draft review service contracts etc work higher management kind support maintenance related tasks roles activities around production environment scope support service provide single point contact first escalation point customer business teams build good relationship customer make sure customer requests promptly handled resolved continuous courteous professional support coverage act customer advocate across departments within netcracker looking education higher technical education experience years progressive experience support fields requiring solid technical skills skills ownership excellent communication skills interpersonal skills ability assume leadership role owning job team player constant focusing results strong troubleshooting skills quick learner consistently sound level judgment professional conduct ability work pressure meet challenging deadlines knowledge sw methodology agile waterfall spoken written english spanish german italian french portuguese considered advantage willingness ability travel optional knowledge solutions experience business transformations program enterprise software telecommunications call center background following concepts technologies nfv sdn cassandra ignite kafka rest api microservices machine learning ability read java code query oracle db would plus offer competitive salary medical insurance covering dental services online consultations doctors 300 hard programs corporate career development center open environment encouraging knowledge sharing culture free english courses opportunity practice foreign languages daily flexible working hours opportunity work remotely,Director,Full-time,"Information Technology, Engineering, and Project Management","Telecommunications, Computer Software, and Information Technology and Services"
Head of Product Marketing Management,,Russia,2021-09-11,< 25 applicants,parcellab leading operations experience management platform growing internationally fast looking best talent across world help us bring people brands closer together ambitious plans looking head product marketing management help us get role charge tell world company story platform makes unique solve buyers problems better solution first hire product marketing team responsible setting hiring managing global product marketing squad include product marketing sales enablement customer advocacy focuses collaborate sales marketing product develop innovative programs drive demand unique approach attention detail eye quality critical success along ability grasp present platforms value proposition way resonates clearly articulates solve buyers problems obsessed tracking performance data prove working looking someone comes preloaded best practices lead team strategically example getting hands dirty digital first company offer greater flexibility working location therefore work one offices london paris munich remotely within uk france germany spain expect build product marketing function ground including hiring onboarding strong bench product marketer along product team responsible educating internal external stakeholders platform features benefits lead planning execution product launches gtm campaigns resulting revenue margin growth happy customers support pricing analysis optimisations grow conversion rates order value lifetime value customer delight responsible creation launch product marketing content product playbooks market requirements sales enablement plans launch plans measure optimise buyer journey relates platform features adoption usage oversee process creating product positioning value propositions messaging resonates buying audience expert buyers behaviours identifying market patterns opportunities industry trends turning challenges meaningful achieve deep understanding operations experience management space parcellab position market analyse competition monitor market competitive shifts need succeed least years experience working similar role least 4 years saas pricing experience saas monetisation experience demonstrated success b2b enterprise saas software company bachelor degree business technology relevant field study experience working partnering groups sales business development product management demand generation ability synthesise large amounts information distil different audience segments clear effective ways ability thrive company execution required processes may exist yet implement experience building quantitative models understand cogs margins price relative impact demand various monetisation strategies know provide solid market intel product using tools excellent verbal written communication skills english nice haves experience building cabs voc programs experience building working customer marketing advocacy programs perks benefits plenty room ideas space try fail learn digital first company choose whether work entirely home one offices mix suits keep growing online language courses company training program professional development budgets access linkedin learning make use home office budget get kitted spacious desk comfy chair houseplants stay grounded free weekly yoga meditation classes part motivated diverse international team consists colleagues future friends parcellab bring people brands closer together closing experience gap beyond transforming operational complexity opportunities outperform brands worldwide including ikea bose puma farfetch nespresso offices munich london paris new york highlighted financial times one technology companies europe day work us monitor three million shipments per day actively managing operations experiences 153 countries across globe send around seven million personalized emails shipping data comes carriers worldwide including dhl fedex dpd creating 30 million reasons people fall love brands day brands means chances create relationships last people buy means turning mundane operational moments moments joy equal opportunities parcellab equal opportunities employer live motto always joy always team always equality means celebrate diversity accept form discrimination harassment believe diversity enriches employee experience allows us deliver best work possible qualified applicants receive consideration employment without regard race colour religion sex sexual orientation gender perception identity national origin age marital status disability status lived experience come part growth contribute ideas share success continue improve customer journey millions people day,Director,Full-time,Product Management and Marketing,"Marketing and Advertising, Computer Software, and Internet"
ISO Director Global Channel Marketing Campaigns,Lenovo,Russia,2021-10-06,< 25 applicants,work lenovo lenovo believe smarter technology spend time building society brighter inclusive go big fortune global 500 company one fortune admired 180 markets working brilliant colleagues counting known world complete portfolio smart technology devices software infrastructure ingenuity help select version smarter future one thing missing job overview description requirements ww channel marketing campaigns director responsible building leading team sets global standards channel campaign execution leader align global marketing geo marketing iso teams ensure deliver global campaign messaging content local execution leader demonstrated collaborative spirit ability build lead teams across functional teams geographies responsibilities duties build lead team channel marketing experts support global geographies business units align team goals strategic business objectives international sales organization iso identify alignment opportunities global geography channel marketing teams augment simplify channel campaign launch execution practices improve quality time revenue objectives business work closely ww marketing drive consistency messaging overall campaign execution across sales geographies work closely 3rd party agencies ideation execution needed align geo channel teams work collaboratively deliver goals objectives partner across iso channel team integrate activities drive performance set strategic vision global channel communications qualifications provide bullet point list qualifications necessary someone fill position bullet points may want include years indirect channel management understanding commercial b2b go market models demonstrated understanding campaign development execution bachelor degree required mba preferred channel sales experience preferred microsoft office proficient equal opportunity employer discriminate employee applicant employment race color sex age religion sexual orientation gender identity status veteran basis disability federal state local protected class,Director,Full-time,Marketing and Sales,Information Technology and Services
Global Director Technical Services,"Church & Dwight Co., Inc.",Russia,2021-09-25,< 25 applicants,collective energy ambition place make real difference company genuinely cares people products consumers environment unique informal culture champions courage determination collaboration knowing open supportive team means us freedom take responsibility ownership shared passion work hard innovate push boundaries united belief strive growth anything possible might largest company industry believe biggest impact together power win role summary lead global animal food production technical sales organization includes dvm phds ensure internal customers sales r marketing external customers trained productive sales goals met exceeded responsibilities develop maintain implement technology service strategy global animal food production business establish arm hammer animal food production technical service support industry standard across swine poultry ruminant markets develop implement new technological offerings optimize profitability customers contribute sales growth ahafp work r directors princeton nj waukesha wi support farm university research programs work global business director provide input annual marketing plan work regional sales managers directors provide global support channel enterprise sales teams across species must able travel 70 including international travel ensure customer satisfaction requirements phd animal nutrition dvm strong nutrition training required mba desired current acan board certification ability become board certified within one year employment mandatory minimum ten years industry university experience support primary expertise dairy nutrition management poultry nutrition management swine nutrition management previous experience leading global technical service organization knowledge experience across multiple animal species preferred proven track record proactively accomplishing assigned goals objectives required training code conduct sexual harassment avoidance church dwight proud equal opportunity disabilities information company brands culture visit us http,Director,Full-time,Information Technology,"Food & Beverages, Consumer Goods, and Financial Services"
Director of Engagement Project Management Office (EPMO),Canonical,Russia,2021-09-18,< 25 applicants,global customers engage canonical deliver complex infrastructure application solutions enable ubuntu hardware deliver new classes smart device projects driven series regional project management teams organised discipline reporting role director engagement project management canonical engagement project management office epmo ensures programmes projects within cloud enterprise devices portfolios delivered successfully director also leads global team ensuring consistent use project management methodology role lead remote team provide active leadership across aspects project delivery serve executive customer escalation point critical projects drive strategic direction integration activities across organisation act trusted advisor company leadership team collaborating executive stakeholders enable customer success also serving system control business owner critical competence centre provide leadership resource allocation problem solving continuous improvement well drive governance around total investment projects support business initiatives including portfolio management delivering business objectives key responsibilities establish promote epmo project management standards across team delivery organisation lead evaluation recommendation programme project management tools systems processes resources driving continued use improvement maturation best practices establish measurable kpis enable executive status reporting across canonical implementing maintaining continuously improving management capabilities reporting support business goals collaborate within operations leadership team across sales field engineering support managed services engineering quality assurance product management implement recommendations address common challenges across projects ensure customer satisfaction accountability roles responsibilities across within projects driving project execution excellence reviewing customer feedback participating customer meetings integrate develop upskill existing pmo teams develop project management capabilities team members epmo via regional team managers setting clear expectations training coaching group individual meetings discussion experience skills extensive experience leading remote project teams internal external project resources experience setting high level strategy successful implementation adept making things happen successfully managing risks demonstrated success building collaborative teams internal external partnerships rapid business growth scale robust effective business leader negotiator comfortable customer facing role experience managing complex enterprise technical projects experience managing projects technology components support development implementation familiarity embedded software development data center architectures server architectures cloud technology openstack fips common criteria certifications preferred degree level education technical field ideally also mba equivalent qualification pmp prince2 practitioner certification strongly preferred willingness ability travel weeks year one week time domestically internationally flexibility work hours support worldwide sales project team,Director,Full-time,Business Development and Sales,"Information Technology and Services, Computer Software, and Internet"
Director of Engagement Project Management Office (EPMO),Canonical,Russia,2021-09-18,< 25 applicants,global customers engage canonical deliver complex infrastructure application solutions enable ubuntu hardware deliver new classes smart device projects driven series regional project management teams organised discipline reporting role director engagement project management canonical engagement project management office epmo ensures programmes projects within cloud enterprise devices portfolios delivered successfully director also leads global team ensuring consistent use project management methodology role lead remote team provide active leadership across aspects project delivery serve executive customer escalation point critical projects drive strategic direction integration activities across organisation act trusted advisor company leadership team collaborating executive stakeholders enable customer success also serving system control business owner critical competence centre provide leadership resource allocation problem solving continuous improvement well drive governance around total investment projects support business initiatives including portfolio management delivering business objectives key responsibilities establish promote epmo project management standards across team delivery organisation lead evaluation recommendation programme project management tools systems processes resources driving continued use improvement maturation best practices establish measurable kpis enable executive status reporting across canonical implementing maintaining continuously improving management capabilities reporting support business goals collaborate within operations leadership team across sales field engineering support managed services engineering quality assurance product management implement recommendations address common challenges across projects ensure customer satisfaction accountability roles responsibilities across within projects driving project execution excellence reviewing customer feedback participating customer meetings integrate develop upskill existing pmo teams develop project management capabilities team members epmo via regional team managers setting clear expectations training coaching group individual meetings discussion experience skills extensive experience leading remote project teams internal external project resources experience setting high level strategy successful implementation adept making things happen successfully managing risks demonstrated success building collaborative teams internal external partnerships rapid business growth scale robust effective business leader negotiator comfortable customer facing role experience managing complex enterprise technical projects experience managing projects technology components support development implementation familiarity embedded software development data center architectures server architectures cloud technology openstack fips common criteria certifications preferred degree level education technical field ideally also mba equivalent qualification pmp prince2 practitioner certification strongly preferred willingness ability travel weeks year one week time domestically internationally flexibility work hours support worldwide sales project team,Director,Full-time,Business Development and Sales,"Information Technology and Services, Computer Software, and Internet"
