jobTitle,companyName,location,datePosted,appStatus,description,seniorityLevel,employmentType,jobFunction,industries
Head of channel mix management,Teva Pharmaceuticals,Russia,2021-09-18,< 25 applicants,company info teva global pharmaceutical leader world largest generic medicines producer committed improving health increasing access quality health solutions worldwide employees core success colleagues 80 countries delivering world largest medicine cabinet 200 million people every day offer uniquely diverse portfolio products solutions patients built promising pipeline centered around core therapeutic areas continually developing solutions significantly growing generic specialty medicines business investment research development marketing business development innovation improve health enable people live better healthier lives join us journey growth job description primary purpose position partner functional business leaders steer development implementation best class channel mix strategies dedicated categories customers general duties responsibilities channel strategy planning channel mix clients working marketers brand planning identifying best interaction mix deliver strategic objectives owned marketing ensure proper execution governance coordination marketing producing content briefs time channels operational planning execution support build marketing channels maintain throughout year plans driving execution channel performance monitoring build kpis per campaign per channel overall track interactions mix performance share formalize learning ensure continuous improvement channel expertise development qualifications university degree years successful work experience managing leading strategic projects gained multinational companies pharma fmcg project management profile rigorous designing managing dashboards management experience likely acquired fmcg channels understanding marketing strategies deep knowledge modern traditional sales channels experience developing implementation channel mix strategies strong interpersonal facilitating skills strong analytical skills ability manage multiple elements multiple stages strategic thinking ability organize affiliate thinking across organization fluency english already working teva current teva employee please apply using internal career site available employee central application treated priority also able see opportunities open exclusively teva employees use following link search apply internal career site internal career site available home network well trouble accessing ec account please contact local partner teva equal employment opportunity commitment teva pharmaceuticals committed equal opportunity employment teva global policy equal employment opportunity provided without regard age race creed color religion sex disability pregnancy medical condition sexual orientation gender identity expression ancestry veteran status national ethnic origin legally recognized status entitled protection applicable laws teva pharmaceuticals committed equal opportunity employment teva policy equal employment opportunity provided without regard age race creed color religion sex disability pregnancy medical condition genetic information marital status sexual orientation gender identity expression ancestry national ethnic origin citizenship status military status status disabled protected veteran legally recognized status entitled protection applicable federal state local laws,Director,Full-time,Sales and Business Development,"Health, Wellness and Fitness, Biotechnology, and Pharmaceuticals"
Director Of Customer Service,Thomas Teleservice,Russia,2021-09-18,< 25 applicants,looking director customer service remote work germany main goals ensure customer satisfaction organize best customer service implement ensure implementation kpis frt art etc ensure high ranking online stores implement automated processes systems build effective interaction sales supply departments warehouse analytics department financial service analyze points interaction client suggest improvements implement analyze result expectations candidate higher education years experience building managing customer support fluent german english confident level experience study work germany desirable experience development implementation performance indicators understanding work result communication skills flexibility please contact information best regards daria,Director,Full-time,,
"Boutique Director, Cartier St Petersburg",Cartier,Russia,2021-09-25,< 25 applicants,title st petersburg boutique director location st petersburg reports retail director russia ukraine cis ambassador maison responsible development optimization boutique performance profitability managing boutique team ensuring excellence boutique operations client service actively participates definition retail strategy within region ensures efficient implementation boutique works collaboratively teams across company building effective working relationships optimize existing new ways working new initiatives implementing new business culture boutique responsibilities boutique performance strategy sales achievement based maison global strategy solid performance analysis review capabilities environment context assists retail director definition network performance strategy region makes diagnosis review competencies environment defines dynamic annual action plans achieve maison boutique category sales targets guarantees implementation regular monitoring action plans amends modifications necessary sets boutique kpis validation retail director ensures monitoring implementation optimizes boutique performance profitability provides time accurate sales reports boutique operations administration strives operational excellence within boutique proactively works boutique team improve professionalism according opportunities constraints responsible respect brand maison policies procedures guidelines coordination local ensures development crm capabilities implementation boutiques supervises boutique back office administration oversees boutique maintenance team management people development recruits boutique staff ensures efficient integration communicates federates motivates boutique team around strategy vision maison group individual implication sets individual objectives evaluates individual performance identifies potentials within team defines idp accordingly collaboration talent development manager gives regular feedback coach team business development manages retail business development projects within region elaborates dedicated action plans ensures implementation collaboration respective team,Director,Full-time,"Sales, Business Development, and Administrative",Luxury Goods & Jewelry
Product Manager (relocation to Montenegro),Libertex Group,Russia,2021-10-02,< 25 applicants,description libertex international financial services group specializing online trading investment founded brokerage firm 1997 since grown diverse group companies brokers dealers educational centers allows group operate globally target 27 countries serve clients 120 countries proprietary mobile online trading platforms libertex offers trading forex crypto stocks cfds futures funds indices company received 100 international awards recognitions including recently named best trading platform 2020 world finance magazine best fx broker europe 2020 forex report increase number registrations via web site raise conversions registration 1st deposit perform product performance measurement funnels speed behavior flow content drill etc market research including ab testing customer journey behavior analysis competitive research analyze customer sales feedback define product roadmap manage product backlog interact developers writing requirements sprints definition supporting rollouts cooperate stakeholders access management support product users key skills required years product management web sites desktop mobile end end b2c relevant higher education knowledge internet marketing seo ability work analytical tools google analytics etc experience working agile teams good interpersonal skills develop relationships team members customers presentation organizational skills experience working teams ability work multitasking environment english additional skill preferred project management skills understanding forex crypto trading offer work seaside mountains fun friendly environment competitive salary available euro crypto quarterly bonus based company performance relocation employee immediate 21 working days annual leave plus 14 days public holidays annual reimbursement flight home employee family corporate events team building activities udemy business unlimited membership language training courses opportunity excel professional car,Director,Full-time,"Product Management, Marketing, and Business Development","Financial Services, Capital Markets, and Information Services"
"Finance Director, Russia, CIS and Export Markets",MSD,Russia,2021-10-07,102 applicants,animal health russia cis export markets finance team providing wide range financial support services local organization focus financial planning analysis decision support animal health commercial business leadership role provide support general managers russia cis export markets teams business unit directors role member leadership team helping shape drive strategic direction business working regional finance bsc teams ensure accurate timely reporting analysis business operations ability challenge influence senior level essential role reports regional finance director euram east finance animal health responsibilities include following oversee fp activities russia cis export markets animal health organization conduct pricing analyses deal evaluation profitability analyses business support growth profitability strategic objectives drive business review analyze financial business performance key metrics document financial highlights enable regional divisional leadership understand key risks opportunities determine progress plan liaise country finance bsc teams manage consolidation analysis reporting monthly quarterly annual revenue commercial spend provide timely information insights drivers key variances collaborate senior members regional fp team manage annual planning calendar involving coordination strategic plan budget forecasts providing short term strategic pricing decision support analysis ensure pricing decisions contribute growth profitability objectives organization support expense management resource allocation decisions ensure effective roi investments review commercial customer rebate data held rebate system calculate necessary accounting entries ensure russia cis export markets revenue recorded according us gaap local global policies revenue recognition visibility gross net sales drivers key focus area russia cis export markets organization play key role driving development processes reporting prepare weekly monthly sales reporting including reconciliation bpc liaise bsc team manage consolidation analysis reporting monthly quarterly annual revenue commercial spend liaise local bsc tp teams ensure actual results understood reflect true position business develop foster strong financial integrity stewardship culture across business liaise teams provide functional support business systems related planning reporting master data management processes partner fp regional corporate leaders align standardized processes share best practices oversee goal setting workload balancing teambuilding professional development general operating parameters fp function financial stewardship ensure financial statements fully comply local gaap statutory profitability qualifications education experiences technical skills bachelor master degree finance business administration similar years experience finance role managerial responsibilities proven financial acumen business partnering skills extended financial understanding strong leadership skills ability lead influence able take broad perspective allowing strategic evaluation problems fluent english communicative persistent able negotiate efficient accurate goal oriented flexible open challenges team player focus collaboration communication interpersonal skills able create positive relationships across teams functions collaboration establishes structures policies practices facilitate effective collaboration across organization uses recognition rewards ways promote team cooperation assists coaching people areas financial effectiveness talent accurately assesses develops strengths weaknesses others individualized development plans skillfully attracts selects new talent organization consistently provides candid constructive performance feedback holds regular formal discussions direct reports monitor progress evaluate performance established go,Director,Full-time,"Finance, Accounting/Auditing, and Management",Pharmaceuticals and Veterinary
"Modality Manager, Ultrasound, CV",GE Healthcare,Russia,2021-10-02,< 25 applicants,job description summary customer facing staff responsible winning business impacts approaches projects programs functional area affected business organization ways working impacts quality efficiency effectiveness team guided commercial practices policies may shaped role significant commercial priorities moderate autonomy within role enter commercial arrangements high levels commercial judgement required achieve outcomes required job description roles responsibilities within geographic area responsible selling product services parts solutions projects developing specialized knowledge latest commercial developments area communication skills influence others contributes towards strategy policy development ensure delivery within area responsibility knowledge best practices area integrates others working knowledge competition factors differentiate market uses judgment make decisions solve moderately complex tasks problems within projects product lines markets sales processes campaigns customers takes new perspective existing solutions uses technical experience expertise data analysis support recommendations uses multiple internal limited external sources outside function arrive decisions typically 1st line manager professionals 2nd line manager professional sales department acts resource colleagues less experience may lead small projects moderate risks resource requirements explains difficult sensitive information works build consensus developing persuasion skills required influence others topics within field required qualifications role requires significant experience sales sales knowledge level comparable master degree accredited university college high school diploma relevant experience desired characteristics additional information relocation assistance provided,Director,Full-time,Sales,"Hospital & Health Care, Medical Devices, and Pharmaceuticals"
"Store Manager H&M Home (ТЦ Мега ""Теплый Стан"")",H&M HOME,Russia,2021-09-25,< 25 applicants,описание компании h home interior brand purpose make possible many people create modern inspiring home vision interior brand offering modern design quality best price inspiring sustainable way описание вакансии sm h home important role create excellent inspiring shopping experience customers every day role store manager lead develop team achieve budgeted planned sales profitability sm responsibilities divided five parts customers colleagues procedures planning results profitability ambassador brand together team strive exceed customer expectations drive selling sales floor happens responsibilities provide excellent customer service store coach team always keep customer top mind follow sales goals budgets optimise profit recruit train develop team set example team always acting line h group values h home brand dna h group global leadership expectations ensure best practice store activities back office procedures job sm comes lots responsibility lots fun требования к квалификации looking strong passionate leader full customers please employees guide business goals reach personal qualities also include least 1 year experience role store manager deputy store manager experience developing team hotel business interior experience preferred necessarily interested home furnishing people everyday life home great result driven attitude able cope large workload ability prioritise plan ahead efficient workflow staffing development analytic reflective mindset constantly improve store profitability positive coaching attitude willingness learn improve want grow develop together h home дополнительная информация next store manager first speak manager send full application cv motivation letter english,Director,Full-time,Sales,"Apparel & Fashion, Retail, and Luxury Goods & Jewelry"
"General Manager, Mercure Nizhny Novgorod Centre",,Russia,2021-09-09,< 25 applicants,job description accor leading hotel company managing across 100 countries looking high professional hotel general manager brand mercure hotel region russia responsibilities hotel manager ensures cohesion coordination teams within hotel prime ambassador hotel accor among owning company clientele local institutions community daily basis supervise manage team develop skills lead hotel marketing sales activities local market design implement coordinate actions improve revenue rooms food beverage direct sales divisions build local networks prepare hotel budget monitor profitability departments take corrective measures needed implement brand projects related product sales marketing strategies revenue management per brand recommendations anticipate risks prevent requirements strong managerial skills understanding distribution successful hotel manager experience strong leadership opening experience russia would plus ability motivate animate team guest service oriented hands management personal commitment involvement day day operations knowledge russian english languages mandatory valid work permit work russia сonditions relocation regions two years nizhny novgorod full time local contract,Director,Contract,Management and Manufacturing,"Restaurants, Leisure, Travel & Tourism, and Hospitality"
Sr Pre-Sales Solution Architect,GE Digital,Russia,2021-10-02,< 25 applicants,job description summary responsible activities processes help sales organization achieve business objectives sr solution architect lead customer interactions drive ge digital power generation software adoption around asset performance management operations performance management digital worker cyber security solutions key responsibility primary point contact customers solution implementations strategic technical position sr solution architect establish trusted advisor relationship external customers internal technical teams strong voice prospects customers understanding pain points business issues functional needs work closely sales product management engineering teams establish best approach drive sales solutions adoption around outcomes like reducing costs improving reliability optimizing asset capability responsibilities encompass full process lifecycle assisting software development driving software sales facilitating customer solution adoption job description roles responsibilities work closely regional sales teams account executives develop account plan determine best approach drive sales ged power generation software solutions establish deep understanding customers business technical needs engage lead discovery sessions customers identify business value priorities create trusted business advisor relationship prospect customer business leaders technical teams develop solution architecture framework support solution selling enterprise level help provide vision define system application architecture problem anticipation ability across landscape provide sw hw technical architecture expertise ensure proper solution design develop evolution path migration plans key ge customers current state target ge digital strategy deploying digital solutions concert ge products services provide coverage key customer facing events evangelize ge technology platform appropriate sales forums drive demand continued interest maintain long lasting business relationship customers propose new profitable business opportunities key customers provide technical business oversight projects provide industry expertise required maintain contact communication key project team members participants ensure conformance requirements project customer user expectations build develop awareness commercial strategic value customer within business leadership senior management assist sales marketing teams identify customers benefit ge digital power generation offerings develop profitable marketing strategy customer outreach extending consumer base developing sales message customer presentations shape drive held accountable delivering significant strategic initiatives across broad liaison key stakeholders share technical procedural business knowledge others interface solutions architects smes globally build community train mentor guide business capabilities provided ge provide input feedback product management teams understand ge solutions exist external solutions required ge invest npi achieve customer outcomes responsible major complex assignments business implications manage complex issues within functional areas expertise contribute overall business strategy required qualifications roles outside role requires significant experience sales digital solution architecture knowledge level comparable master degree accredited university college high school diploma relevant experience roles usa master degree accredited university college high school diploma ged least 6 years experience job family group desired characteristics bachelor degree business science engineering technology related discipline masters degree mba advanced degree preferred manages possesses working industry knowledge skillset self others power generation industry experience power generation including thermal combined cycle plant technologies experience multiple aspects energy value chain consumers trading etc expertise developing selling solutions including creating executing propositions track record success understanding technology stack include os db middleware application layer virtualization applicable cloud technologies strong interpersonal skills including creativity curiosity ability effectively communicate influence solution direction technical audiences alike across organizational levels technical acumen interface technologists understand complex concepts translate way businesses industry understand demonstrated problem solving creative skills ability exercise sound judgment make decisions based market customer trends go beyond status quo ability deal ambiguity strategic agility manage diversity drive results demonstrating excellent oral verbal written presentation skills effective communication business organization corporate customers note comply us immigration legal requirements necessary specify minimum number years experience required role based within usa roles outside usa ensure compliance applicable legislation jds focus substantive level experience required role minimum number years used additional information relocation assistance provided,Director,Full-time,Sales,"Computer & Network Security, Computer Software, and Information Technology and Services"
ISO Director Global Partner Training,Lenovo,Russia,2021-10-06,< 25 applicants,work lenovo lenovo believe smarter technology spend time building society brighter inclusive go big fortune global 500 company one fortune admired 180 markets working brilliant colleagues counting known world complete portfolio smart technology devices software infrastructure ingenuity help select version smarter future one thing missing job overview description requirements ww partner competency director responsible building leading team sets global standards framework channel training knowledge transfer certifications leader align global training geo training iso teams ensure execute channel competency programs consistently across business units geographies leader demonstrated collaborative spirit ability build lead teams across functional teams geographies responsibilities duties build lead team channel competency experts support global geographies business units align team goals strategic business objectives international sales organization iso identify alignment opportunities global geography channel training teams establish framework drives partner knowledge competency requirements across sales geographies work closely ww marketing drive consistency messaging overall campaign execution across sales geographies align geo channel business unit teams work collaboratively deliver goals objectives partner across iso channel team integrate activities drive performance set strategic vision global channel communications qualifications provide bullet point list qualifications necessary someone fill position bullet points may want include years indirect channel management understanding commercial b2b go market models demonstrated understanding channel competency industry standards bachelor degree required mba preferred channel sales experience preferred microsoft office proficient equal opportunity employer discriminate employee applicant employment race color sex age religion sexual orientation gender identity status veteran basis disability federal state local protected class,Director,Full-time,Human Resources,Information Technology and Services
