jobTitle,companyName,location,datePosted,appStatus,description,seniorityLevel,employmentType,jobFunction,industries
Director Sales - Pharmaceuticals,Jobskey Search and Selection,"Shanghai, Shanghai, China",2021-09-09,< 25 applicants,job role maximize market coverage assigned accounts various strategies industry networking focused plans certain market segments accounts inside sales etc achieve top line bookings revenue goals quarter quarter converting openings existing new clients developing proposals conducting pitches new business closing activities develop compelling value propositions position effectively relative competition expand footprint key accounts development short term account strategies specific account successful execution account strategy help hone competitive positioning key messages based feedback clients prospects evaluating long term trends industry required experience skills least 10 years business development experience pharmaceutical pharmaceutical services industry client oriented attitude focus creating strong relationships clients encouraging others work towards goal strong influencing communication skills create meaningful partnerships advance business development goals ability experience engage senior level professionals vp across medical marketing commercial procurement verticals client organizations ability identify opportunities within client organization define solutions working sme organization close business track record growing businesses via new logo acquisition account management kind regards jobskey consultancy ksa office email consultant website uk email resumes website india email resumes website,Director,Full-time,Sales and Business Development,"Information Technology and Services, Computer Software, and Internet"
Sales Leader Furniture 销售总监 办公家具,上海浩元企业管理咨询有限公司,"Shanghai, Shanghai, China",2021-09-09,< 25 applicants,该职位来源于猎聘 customer service focus retention growth operating approved customer management plan clients identify know key staff target firms ds builders pms end users etc customer relationship maintained work experience dealing us assessed opportunities improvement customer company business relationships responding resolving service issues raised customers maintaining customer database within pronto materialise opportunities ensure specified tender lists respond tender requests accurate estimating quoting,Director,Full-time,Sales and Business Development,Consumer Services
独联体区域销售总监 Regional Sales Director (CIS)(J11977),United Imaging Healthcare,"Beijing, Beijing, China",2021-09-09,< 25 applicants,该职位来源于猎聘 工作职责 prepare implement sales strategy region responsible regional sales quota complete annual sales target develop new distributors key accounts order improve coverage market share uih product region understand adapt company culture familiar internal procedure improve work efficiency cross culture communication effectively communicate features benefits uih products prospective customers develop manage relationship kol doctors important customers establish positive reference region organize prepare participation local exhibition congress seminar order promote uih brand collect marketing information competitor share hq time suggest assist preparation marketing materials regional promotion purpose sales forecast project funnel management assist regional vp establish local platform improve customer satisfaction establish market competency 任职资格 bs master degree medical business adminstration equivalent experience minimum 10 years experiences working international medical manufacture develop regional channel network key accounts medical imaging diagnostic system dr experience preferred ready take challenge willing develop new brand perform breakthrough latin america know develop manage customer relations experience working customers levels could accept frequent travel fluent english,Director,Full-time,Sales and Business Development,Medical Devices
Director of Sales 销售总监,,"Shenzhen, Guangdong, China",2021-09-25,< 25 applicants,工作职责 draw hotel sales activity plan collaboration cd general manager hotel sales activities aim optimal room occupancy f b sales revenues implement sales action plans related respective market outlined hotel revenue plan achieve necessary goals targets set closely monitor accounts revenue business production accounts portfolio sales team rooms catering business 任职条件 least 3 years working experiences sales director level knowledge corporate travel segment previous working experience hotel chain local international fluency level english mandarin 中英文流利 possess strong administration management skills 具备优秀的行政及管理技巧,Director,Full-time,Sales and Business Development,"Leisure, Travel & Tourism"
Director of Sales - Corporate销售总监 - 公司客户,Fairmont Hotels & Resorts,"Chengdu, Sichuan, China",2021-09-18,< 25 applicants,primary responsibilities主要职责 director sales required times set strong example leadership observance hotel company policies procedures interdepartmental cooperation observance hotel company policies procedures include promotion participation colleague engagement survey ces health safety jd power initiatives contracts room nights reviews team member contracts considering number rooms average rate total revenue objectives hotel outlines administers weekly sales call plan ensure time resources maximized complete many qualified calls possible balancing administrative duties well site inspections outlines administers weekly site inspection plan new prospective clients exposed hotel future business opportunities existing clients kept date upgrades enhancements done within hotel participates sales trips promotional events within hotel trade related organizations necessary participates referral program goal referring business sister maintains positive relationships guests vendors assists director sales marketing recruit retain sales colleagues maintains account contact activity business details within opera c according fairmont standards ensures delivery expected guest service follow coordination hotel departments prepares weekly monthly quarterly annual reports required assists preparation hotel revenue objectives compilation market intelligence set individual room revenue room night goals provides ongoing sales direction direct reports reviewing contracts coaching conduct prospecting sales calls site inspections attendance rate strategy meetings regularly scheduled sales departmental meetings group business meetings oversees administrative colleague workload actively participates prescribed sales training c knowledge experience知识和经验 knowledge opera sales catering opera pm outlook word excel power point minimum two years experience senior sales manager director market exceeds annual sales activity goals career results oriented ability flexible hours days assignment additional duties must able work well pressure fast paced constantly changing environment excellent written verbal communication skills must strong team player proven leadership development delegating skills high guest service skills talent knowledge vision ability lead colleagues excellence english second language 熟知opera opera pm outlook word excel powerpoint 超越年度销售和活动目标 必需能够在一个快节奏和坏境不断变化的高压力下工作 team working environment fairmont chengdu situated within palm springs international centre located heart tianfu new area chengdu zone adjacent century city new international convention exhibition center global center tianfu software park hotel features 336 guest rooms willow stream spa gold executive floor square meters meeting facilities collection f b concepts including restaurant spectrum cube concept lounge cocktail bar restaurant signature sichuan chinese restaurant chang yi feature restaurant miku occupying top level hotel hotel opened door december 21 2016 食百绚 cube 尝艺 觅 note customization may included specific local legislative requirements work permits commitment diversity inclusion inclusive company ambition attract recruit promote diverse talent work accor far worldwide leader welcome find job brand matches personality support grow learn every day making sure work brings purpose life journey us continue explore accor limitless possibilities joining accor every chapter story write together imagine tomorrow hospitality discover life awaits accor visit https love care world dare challenge status quo belimitless 21016981,Director,Contract,Sales and Business Development,"Restaurants, Leisure, Travel & Tourism, and Hospitality"
Director of Sales & Marketing 市场销售总监,InterContinental Hotels & Resorts,Zhenjiang-Yangzhou-Taizhou Metropolitan Area,2021-09-09,< 25 applicants,produce annual revenue plan marketing budgets forecasts produce action plan related revenue plan ensure revenue plan objectives achieved provides professional advisory support service general manager 向总经理提供专业的咨询服务 coordinate methods maintaining increasing business volume includes advertising sales promotion personal selling publicity community relations special sales projects etc create implement special programs achieve greater profitability increasing average rate 提高平均房价 increasing overall occupancy 提高整体入住率 increasing business volume periods 提高淡季业务量 increasing local food beverage banquet sales 增强在当地的餐饮和宴会销售 enhance image hotel local community 提高酒店在当地社区的声望 participate active member community associations memberships trade organizations review regularly activity reports sales marketing personnel ensure targets sales objectives met review regularly internal promotion pieces visual effect ensure conform brand standards organize promote cooperation food beverage department special projects stimulate food beverage sales within community including limited tournaments balls parties gastronomic festivities etc interacts individuals outside hotel including limited clients convention bureaus local hotel associations government tourist offices airlines travel agents tour operators competitors members local community investigate potential markets reviewing sales department front office correspondence files 对销售部和前台的通信文档进行检查 analyzing guest history registration card files 对客史档案和登记卡档案进行分析 studying guest questionnaires 研究客户调查问卷 reviewing government statistics visitors city 研究政府对来当地旅游的游客的统计数字 analyzing competition efforts 分析竞争对手的销售和促销工作情况 review regularly public relations activities ensure high awareness hotel local national media works director finance preparation management department budget demonstrated ability interact customers employees third parties reflects highly hotel brand company problem solving reasoning motivating organizational training abilities proficient use microsoft office 精通微软办公软件 good communication writing skills 良好的沟通和写作技能 3 years relevant experience similar supervisory role equivalent combination education experience nul,Director,Full-time,Sales and Business Development,Hospitality
Assistance Director of Sales 销售副总监,InterContinental Hotels & Resorts,"Yibin, Sichuan, China",2021-09-09,< 25 applicants,financial returns 财务回报 validate potential assigned accounts create account plans per ihg hotels standard operating procedures develop assigned portfolio meet set goals maximise profitability gather information current prospective clients contacts generate incremental business 员工关系 use account interaction publicly available tools monitor competitors activities relates hotel portfolio accounts share relevant information key stakeholders line hotel procedures provide feedback management changing market conditions including competition market trends conduct annual performance reviews set key performance objectives personal development plans line ihg standards brand standards member team regular reviews team members assess performance line metrics expectations ihg hotel take action appropriate guest network within one portfolio accounts build relationships key decision makers relevant staff conduct client meetings well planning coordinating site introduction tours inspections handle manage clients queries issues proactive responsible follow new sales leads enhance guest experience degree diploma marketing business hospitality management desired minimum one year relevant experience equivalent work experience team management least 2 years relevant sales experience hospitality related service industry expected possess following skills 具备以下技能 experience knowledge establishing mentoring sales team 有建立和指导销售团队的经验和知识 knowledge sales principles techniques 深入了解销售原理和技巧 effective communication negotiation skills 有效的沟通和谈判技巧 strong knowledge hotel products rates marketing programmes excellent pc skills including ms office 优秀的计算机技能 包括ms office ability develop strong relationships customers stakeholders 与客户和其他利益相关者建立良好关系的能力 knowledge experience sales systems delphi opera etc advantageous 销售系统知识和经验 如delphi 歌剧 等 是有利的 nul,Director,Full-time,Sales and Business Development,Hospitality
Financing Director - US listed company,Michael Page,"Beijing, Beijing, China",2021-09-18,< 25 applicants,financing director us listed company listed company global operation director level position supporting commercial electric vehicles business client client listed company headquartered operating globally vision facilitating adoption commercial electric vehicles job description director level position key objectives work oem dealer partners create leasing programs support commercial ev sales work local central governmental agencies licensing regulatory approvals leasing programs develop channel partner programs leasing financing part scope maintain clear status reporting progress china us leadership teams successful applicant preferred candidates years experience either financing leasing financing partnership sector needs financing expert various assets vehicles commercial equipment effectively engage financing partners set lending purchase programs vehicle sales person need extensive professional network relationships chinese leasing financial institutions proven track record successful business development needs demonstrated leadership capabilities fluent english mandarin offer role reports cfo based suitable experts auto financing banking experience offer attractive package top talents well platform career development contact sabrina zhang quote job ref 4174252,Director,Full-time,Business Development and Sales,Financial Services
湘西皇冠假日酒店-市场销售总监/Crowne Plaza Xiangxi-Director of Sales & Marketing,InterContinental Hotels & Resorts,"Xiangxi Tujia and Miao Autonomous Prefecture, Hunan, China",2021-09-09,< 25 applicants,essential duties responsibilities key activities role produce annual revenue plan marketing budgets forecasts produce action plan related revenue plan ensure revenue plan objectives achieved provides professional advisory support service general manager coordinate methods maintaining increasing business volume includes advertising sales promotion personal selling publicity community relations special sales projects etc create implement special programs achieve greater profitability increasing average rate increasing overall occupancy increasing business volume periods increasing local food beverage banquet sales enhance image hotel local community participate active member community associations memberships trade organizations organize promote cooperation food beverage department special projects stimulate food beverage sales within community including limited tournaments balls parties gastronomic festivities etc interacts individuals outside hotel including limited clients convention bureaus local hotel associations government tourist offices airlines travel agents tour operators competitors members local community review regularly public relations activities ensure high awareness hotel local national media manage development new products services oversee development new marketing strategies conduct market research maintain good communication regional sales marketing personnel implement corporate initiatives works human resources manpower planning management needs works director finance preparation management department budget required qualifications required skills demonstrated ability interact customers employees third parties reflects highly hotel brand company problem solving reasoning motivating organizational training abilities proficient use microsoft office good communication writing skills qualifications bachelor degree sales marketing related field experience 4 years relevant experience similar supervisory role equivalent combination education experience nul,Director,Full-time,Marketing and Sales,Hospitality
Sales Director 销售总监,,"Shenzhen, Guangdong, China",2021-09-09,< 25 applicants,该职位来源于猎聘 key responsibilities business development strategy person heavy focus sales strategy management results able develop complex offers capability developing strategy team deal market evolution well venture new markets commercial building education etc set propose sales strategy regarding corporate accounts determines annual unit plans implementing marketing strategies analyzing trends results take lead developing major corporate accounts participate development business branches nationwide plan coordinate business development strategies reach bd team yearly target maintain relationships corporate accounts constantly find develop new corporate prospects keep constant relationships existing major clients collect feedbacks improvement expand ifm establishes sales objectives forecasting developing annual sales quotas regions territories projecting expected sales volume profit existing new services implements national sales programs developing field sales action plans follow results maintains sales volume services mix selling price keeping current supply demand changing trends economic indicators competitors completes national sales operational requirements scheduling assigning employees following work results weekly monthly annually search new information potential clients contributes team effort accomplishing related results needed maintains professional technical knowledge attending educational workshops reviewing professional publications establishing personal networks participating professional societies trade show event chambers etc sales management coaching support business development department branches centralize prospects ensure information correctly dispatched business development managers participate marketing sales offer client working jointly sales team recommendation production overall commercial documents presentations proposals contracts etc maintains national sales staff recruiting selecting orienting training employees maintains national sales staff job results counseling disciplining employees planning monitoring appraising job results market research implement market research studies relevant segments support overall marketing sales strategy monitor market competition anticipate actions competitors key skills competencies bachelor degree minimum 15 years sales experiences corporate services least 5 years experience senior sales management role leading sizeable team reasonable annual sales target nationwide preferably experience international context international companies vietnamese english skills reading writing preferred able blend environment also necessity role considerable client base especially large corporate accounts good management skill able lead coach motivate team take responsibility leading team achieve ambitious annual sales target good networking skills willing spend time major clients accounts decisive key role main sales projects door opening negotiating deal closing besides managing sales team result oriented responsible well organized industry knowledge facility service food service maintenance service technology services would great plus ability think box bring new innovation strategic mindset work also key role passionate career oriented enjoy appreciate work entrepreneur type company good addit,Director,Full-time,Sales and Business Development,Consumer Services
Sales Representative-Hangzhou销售代表,士卓曼(北京)医疗器械贸易有限公司,"Hangzhou, Zhejiang, China",2021-09-09,< 25 applicants,job summary sales rep responsible market development implant market sales rep increase revenues market share ka developing new channels achieve sales targets customers increase measures success meet annual sales target end user focus promote spec straumann product responsible application territory end user demand creation defend grow share territory key account identify capture share gain opportunity assigned territory support territory leader execute channel management collect feedback competitor industry information skills experience required bachelor degree major dental related field 5 years sales experience dental industry medical device industry implant relevant high priority multinational companies working experience preferable good key account management skill good selling skills customer orientated good team work spirit flexibility travel frequently,Director,Full-time,Sales and Business Development,Medical Devices
武汉洲际酒店 - 市场销售总监 / InterContinental Wuhan - Director of Sales & Marketing,IHG Hotels & Resorts,"Wuhan, Hubei, China",2021-10-08,< 25 applicants,us essential duties responsibilities key activities role produce annual revenue plan marketing budgets forecasts produce action plan related revenue plan ensure revenue plan objectives achieved provides professional advisory support service general manager coordinate methods maintaining increasing business volume includes advertising sales promotion personal selling publicity community relations special sales projects etc create implement special programs achieve greater profitability increasing average rate increasing overall occupancy increasing business volume periods increasing local food beverage banquet sales enhance image hotel local community participate active member community associations memberships trade organizations organize promote cooperation food beverage department special projects stimulate food beverage sales within community including limited tournaments balls parties gastronomic festivities etc interacts individuals outside hotel including limited clients convention bureaus local hotel associations government tourist offices airlines travel agents tour operators competitors members local community review regularly public relations activities ensure high awareness hotel local national media manage development new products services oversee development new marketing strategies conduct market research maintain good communication regional sales marketing personnel implement corporate initiatives works human resources manpower planning management needs works director finance preparation management department budget day day required qualifications required skills demonstrated ability interact customers employees third parties reflects highly hotel brand company problem solving reasoning motivating organizational training abilities proficient use microsoft office good communication writing skills qualifications bachelor degree sales marketing related field experience 4 years relevant experience similar supervisory role equivalent combination education experience appli,Director,Full-time,Marketing and Sales,Hospitality
