jobTitle,companyName,location,datePosted,appStatus,description,seniorityLevel,employmentType,jobFunction,industries
National Sales Manager,Wyser,China,2021-09-11,Over 200 applicants,title national sales manager one international brand consumer goods industry major responsibility information national sales management business development existing business maintenance channels development team management etc develop execute targeted white space opportunities greater penetration client marketing new product lines seeks increase revenue translating client challenges opportunities sell products services across company portfolio drive revenue growth leads development delivery innovative proposals capture account growth new business opportunities consultative selling skills relationship clients decent effective efficient presentation skills solid sales experience consumer etc area team work communication proactive good communication negotiation skills proactive good english communication skills college degree abov,Director,Full-time,"Sales, Business Development, and Management","Consumer Electronics, Consumer Goods, and Furniture"
Head Of Sales,Yodo1 Games,"Beijing, China",2021-07-09,< 25 applicants,please read carefully use url apply https location remote anywhere yodo1 mas care mas managed ad services platform changing game developers see video mas core yodo1 helping mobile game developers turn titles scalable business today platform helping thousands developers around world maximize mobile game monetization singular focus 2021 rapidly scaling user base turning passion livelihood many thousands care much want team right hiring head sales lead new mas sales teams drive exponential growth customer base revenue opportunities join yodo1 team opportunity learn grow leading diverse international team developing management skills working leaders experts platform publishing departments taking part strategic decisions gaining wealth knowledge industry identifying unique pain points developers face driving solutions responsibilities managing two sales teams leader reporting directly working operations manager generate simple insightful reports show health progress business presenting weekly working top bottom funnel order increase number calls closing ratio cooperating leads generation team run continuous improvements talking developers learning care taking insights back team drive growth requirements proven sales experience minimum 2 years meeting exceeding sales targets proven experience leading team five people proven experience scaling team process yodo1 expansion think scalably advance quickly experience gaming industry required plus experience saas company strong ability communicate present ideas working colleagues clients multiple countries must able communicate clearly concisely proactively pay based qualifications experience fit role apply change game game developers please use url submit application https,Director,Full-time,,
Head of Sales,Wyser,"Shanghai, China",2021-07-09,< 25 applicants,client introduction italian company one largest manufacturer distributor specialty dessert ingredient solutions key responsibilities regional commercial head taking care greater china region japan korea new customer acquisition key account maintainence direct selling field chanel sales management evaluation supervision distributors market research margin analysis localized sales strategy development future scope pastry technical demonstrator country manager ideal profiles least 5 years experience sector ingredients pastry ice cream food cafeteria bakery etc experience selling field preferred bachelor degree excellent interpersonal communication skills adaptable changing dynamic business environment able work independetnly collaboratively culture awareness preferable experienced working italian companies fluency chinese english speaking italian preferred offer opportunties growing business scratch fix term contract intrim contract competetive annual salary car provided allow,Director,Full-time,"Business Development, Sales, and Customer Service",Food & Beverages and International Trade and Development
"Country Sales Head, SMB",Surrienta Consulting,"Shanghai, China",2021-06-09,< 25 applicants,responsibilities strong track record candidate strong successful track record entering penetrating new markets addition candidate demonstrate proven success building strong team executing plan lastly candidate demonstrated aptitude operating thinking strategically also willing roll sleeves get details work directly customers appropriate strategic focus candidate acquire strong understanding ecommerce import export space ecosystem key stakeholders business payments payment opportunities problem solving candidate strong capabilities entering new market many moving parts uncertainties easy candidate thrive environments ability build design solutions value propositions pitch presentations enable large sales team collaborative candidate work closely support sales product development marketing land expand strategy extremely data centric candidate provide timely accurate useful analyses concerning status new business verticals including progress professional experience qualifications minimum ten 10 years progressive service experience various b2b organizations least five 5 years director role demonstrated success requirement roles experience within global organization working customers variety sizes around world including north america europe china latin america aptitude project management concurrent projects developing scalable systems processes manage enhancing customer experience aptitude balancing resource constraints budgeting raising bar quality service delivery working knowledge either payment industries keen sense ethics integrity leadership characteristics knows business technical functional skills needed job understands various types business propositions understands businesses operate general learns new methods technologies easily strong commitment data driven environment emphasis performance management inspires team become customer centric committed excellence solve even toughest complex problems great gleaning meaning whatever data available quick study new different adds personal wisdom experience come best conclusion solution given situation uses multiple tools techniques well organized resourceful planful effective efficient marshaling multiple resources get things done lays tasks sufficient detail mark trail able get things done less less time work multiple tasks without losing track foresees plans around obstacles fearlessly takes issues challenges people comfortably confronts works conflict delivers negative feedback messages without hesitation deals promptly fairly problem performers lets everyone know stand thrives crises energized tough challenges afraid make negative decisions take tough action challenges status quo attacks everything drive energy eye bottom line afraid initiate action facts known drives finish everything starts writes presents effectively adjusts fit audience message strongly gets message across person high character consistent acts line clear visible set values beliefs deals talks straight walks talk direct truthful time keep confidences please send us updated resume detailed discussion email,Director,Full-time,,
Sales Strategy Manager,Johnson & Johnson China,"Shanghai, China",2021-09-18,< 25 applicants,sales strategy manager contributes company objectives leading channel strategy acting main point contact brand team leading business intelligence analytics efforts role leads team 4 people responsible coaching developing time guarantees creation deployment annual channel plans strategies growth aligned company lrfp roadmap complex nature involves deep knowledge china pharmaceutical market landscape critical key stakeholder development deep collaboration internal stakeholders guarantee needs taken consideration company planning process product development lead development channel management vision incorporating insights brand customer channel working closely customers drive joint business plans delivering innovative thinking high level understanding insights category working close collaboration marketing sales identify future channel trends develop channel growth drivers lead channel strategy development keep governance execution anz ability shape business intelligence making sure meaningful insights intel provided commercial team drive better results benchmark external practice ongoing enhancements innovations contribute building organizational capability advanced analytics identifying opportunities connection leverage data sets identifying potential data sets well strategic input around areas innovation proof concept testing set strategic direction sales strategy operations team coach develop support team growth accelerating development key talent proactively maintain external networks view identifying high potential talent qualifications fluent english demonstrated financial acumen ability translate effective business decision making genuine comfortable people leader demonstrated track record people development leadersh experience working matrix environment cross functional teams experience working global organization collaborating global regional groups plus,Director,Full-time,Sales and Strategy/Planning,"Hospital & Health Care, Consumer Goods, and Pharmaceuticals"
Sales Director,Encore APAC,"Beijing, China",2021-09-09,< 25 applicants,ideal candidate responsible overseeing sales teams operations strategies researching market trends conducting competitor analysis develop implement sales strategies candidate report regional general manager based sydney lead business department 30 colleagues beijing shanghai responsibilities develop implement sales strategies lead sales team 10 win new clients cases assist general manager update internal processes prepare operational financial sales department reports oversee management learning career development sales team directly coordinate joint marketing initiatives maximize exposure profitability qualifications bachelor degree equivalent experience fluent chinese english years sales leadership experience years experience sales strong leadership skills successful cas,Director,Full-time,,
Overseas Sales Director,GraceSolar,"Xiamen, Fujian, China",2021-09-11,< 25 applicants,ideal candidate responsible overseeing sales teams operations strategies researching market trends conducting competitor analysis develop implement sales strategies responsibilities develop implement sales strategies prepare operational financial sales department reports oversee management learning career development sales team directly coordinate joint marketing initiatives maximize exposure profitability qualifications bachelor degree equivalent experience years sales leadership experience years experience sales strong leadership skil,Director,Full-time,,
Store Manager,Hermès,"Shanghai, China",2021-09-09,< 25 applicants,profit loss management plans development sales boutique builds annual budget keeps track foreseeable sales expenses achieves net profitability line within agreed budget prepares weekly sales summary monthly reports sales management ensures clients properly served develops selling strategy based market trends sales objectives inventory control implements strategy quality oriented sales policy ensures sales team fully understands selling strategy applies prepares sales budget every 6 months buying implements proper buying strategy based specificity boutique demand inventory sales objectives inventory manages inventories way order increase sales keep financially healthy stock level fully aware inventory product lines times anticipating stock shortages maintaining reasonable levels much possible optimizes sales boutique ensuring needed stock available regularly reordering merchandising trains sales team develop proper merchandising skills maintains shop display environment company set standard daily operation customer service ensures member sales team provides excellent service individual entering boutique line hermès standards customer service develops sales goodwill proper service clients always present team case conflicts team management motivates sales team serve clients excellent standards employs retains high quality staff right compensation level keep track individual performance defining tasks setting goals ensures team receives proper training regularly order develop customer service product knowledge selling skills oversees ensures leaves taken line company policies procedures untaken annual leaves properly managed creates sense team spirit discipline mutual respect well dedication loyalty company ensures everyone team receives proper support order achieve full potential sales administration ensures procedures systems clearly understood run smoothly comply needs sales activities ensures sales activities properly processed according company procedures processes proper sales reporting according company procedures communications assists marketing team implement communication activities relations boutique proposes marketing team communication activities could help achieve sales objectives boutique times proper ambassador hermès visitors boutique ensure member sales team also acts ambassador brand property management keeps hermès boutique excellent states times ensures proper maintenance renovation works line agreed budget aware neighboring property market inform supervisor requirements capabilities tertiary educated least 10 years relevant management experience fashion luxury industry similar capacity strong business sales sense solid analytical skills ability lead drive performance customer service good customer relationship management skills excellent spoken written english chinese french plus must good team player pleasant service oriented self motivated strong leadership interpersonal communication skills hands computer knowledge ms offic,Director,Full-time,Sales and Business Development,Luxury Goods & Jewelry
National Key Account GM-Private,GE Healthcare,"Shanghai, Shanghai, China",2021-09-25,< 25 applicants,job description summary customer facing staff responsible winning business commercial business operating guidelines budgets guided functional policy autonomy within role enter commercial arrangements high levels commercial judgment required achieve outcomes required job description essential responsibilities achieve targets assigned key accounts within budget target get access builds relations develop business strategy maximize business opportunities products services within allocated key accounts represents 1gehc acts primary customer point contact allocated proactively build network government bodies key opinion leaders well deep understanding healthcare assigned strategic key accounts collaborate rgms zsms service company resources provide necessary technical equipment service clinical content customers coordinate one ge healthcare team strategic accounts order deliver solutions meet exceed customer develop maintain high level customer satisfaction consistent high quality interactions customer build long term strategic alliance portfolio accounts continue add follow ge policies procedures operating mechanism proactively participates company initiatives depending organizational needs directed management ensure knowledge compliance integrity company extensive experience 8 years business management sales marketing progressive leadership positions within healthcare industry knowledge healthcare market decision financial acumen demonstrated ability interpret present internal external financials reflect overall business customer drivers proven key account management complex project planning skills advanced negotiation problem solving high level communication skills including presentation skill able present ideas customers internally way produces understanding outstanding influencing interpersonal networking skills drive collaborative culture outcome engaging inspiring leader able travel 70 percent work characteristics additional eligibility qualifications additional information relocation assistance provided,Director,Full-time,Sales,"Hospital & Health Care, Medical Devices, and Pharmaceuticals"
International Sales Manager,Junjue Consulting,"Shenzhen, Guangdong, China",2021-08-09,< 25 applicants,国际销售经理 任职要求 international sales manager formulate implement regional marketing channel development plans strategies quantify sales objectives assist director develop establish maintain overseas markets seek track foreign customers maintain old customers train new people market development customer maintenance sales management collect regional market information information international exhibitions competitors competitive products visit foreign customers regularly irregularly participate foreign exhibitions etc participate foreign trade cooperation negotiations assist establishing maintaining foreign sales networks job requirements five years international sales experience familiar international market experience international sales medical devices preferred fluent oral english proficient computer daily office software bachelor degree major biology international trade english medicine preferred good communication skills team spirit strong problem solving ability tolerance,Director,Full-time,,
Sales Director (North China),Oracle,"Beijing, China",2021-04-09,26 applicants,part helping clients go digital transformations moving cloud excite passion helping organizations journey cloud secure improve move govern data capital assets cloud cutting short term ambiguity longer term vision come second nature answered questions could oracle transformed enterprise software market cloud computing data driven innovation launched business apps platforms easy use differentiated advantage able offer identical portfolio infrastructure platforms services data management role traditional db software sales executive changing pivot next generation cloud computing dramatically increase addressable market reach wallet share sales executive demonstrate value helping database install base customers move database targeting workloads oracle cloud person instrumental increasing cloud paas iaas bookings well database license revenues work closely enterprise clients selling new services well bringing net new business territory responsibilities define strategies act generate long term short term customer success business results lead manage sales team successfully achieve quarter goals manager team performance conduct coaching training necessary exceed quarterly sales targets selling oracle database named accounts within north china area manage entire sales process ensure delivery key performance metrics strong emphasis new business sales expanding existing accounts pipeline development combination cold calling email campaigns market sector adequate pipeline ensure within designated territory engage prospect organizations position oracle solution value based selling business case definition roi analysis references analyst data manage end end sales process engagement appropriate resources pre sales consultants business development consultants oracle consulting executives partners effective utilization selling tools engineered selling process esps customer 360 etc daily update oracle sales cloud system accurate customer pipeline data accurate monthly forecasting revenue delivery requirements minimum 15 years relevant experience selling enterprise software solutions services 8 years experience team management successful history net direct new business sales ability prove consistent achievement targets ability build reciprocal relationships different parts business partners customers identifies synergies across lobs acts opportunities integrate business credibility levels including lines business cxo solid understanding industry cloud landscape market sales experience cloud vendor would beneficial competencies building value proposition positioning strong proposals strong interpersonal skills proven ability communicate across levels effectively adapts varied situations creative strong problem solving skills ability adapt succeed fast paced ambiguous environment proven ability work well part extended sales team,Director,Full-time,Sales and Management,Information Technology and Services
International Sales Director,Junjue Consulting,"Shenzhen, Guangdong, China",2021-08-09,36 applicants,国际销售总监 international sales director job description according company development strategy cooperate deputy general manager study formulate development plan international market expansion strategy strategy market development aspects according company development operation objectives decomposed department sales targets made sales plans established improved sales channels overseas markets expanded brand awareness overseas markets trained guided team members led sales team continuously effectively carried team building management maintained continuous growth team performance job requirements bachelor degree major international trade foreign language minor language portuguese spanish arabic russian english french preferred least 3 years working experience industry familiar global overseas market good team building staff training able effectively coordinate resources across departments ensure achievement objectives 3 strong ambition clear goal strategic vision good foresight adapt business trip,Director,Full-time,,
China Sales Director,Surrienta Consulting,"Beijing, China",2021-08-09,< 25 applicants,requirements years experience sales leadership role mobile technology company track record top performance previous experience recruiting scaling team growth company ability understand sdk communicate benefits technical customers strong interest mobile technology mobile sdks willingness travel frequently full written speaking fluency english strong work ethic internal drive produce results experience managing pipeline using salesforce similar sfa tool humility mentality nice haves prior experience selling china export mobile ecosystem thorough understanding mobile advertising measurement attribution mba management consulting equivalent experience finance operations please send updated resume interested,Director,Full-time,,
"Sales Leader, Retail",Confidential,"Shanghai, China",2021-08-09,< 25 applicants,summary sales leader maintains grows relationships existing large customers achieving assigned sales profit growth goal sales leader expected retain existing business pursuing profitable growth opportunities working closely sales team sm responsible supporting complete product service offering retail clientele reporting sales vp apac sales leader responsible achieving assigned sales profitability goal works closely sales specialists implementation resources service resources sales management resources achieve preserve customer satisfaction problem resolution person add significant value organization providing expertise throughout sales process ultimately influencing sales responsible support deals deliver architectural designs engaging relevant client functions interface delivery units maintain deep expertise area responsibility support client engagements proposals requested evangelist solution domain demonstrates organization thought leadership work closely sales team apac proposals pitches business deliver presentations product demonstrations remotely require credible knowledge salesperson provide working closely collaboratively customers prospects understand capture requirements devise effective solutions putting together business cases sales teams support proposals liaising product managers provide feedback clients product requirements provide ideas help innovate stay ahead market going timely response customers following requests information proposals carry research stay ahead area expertise including understanding current future market product competitor landscape manage sales bid process responding rfi rfp client prospect puts opportunity tender respond technical questions product related infrastructure qualifications minimum bs required minimum 12 years experience selling solutions ability translate technical information way easy understand personnel strong skills experience dealing senior manager contacts strong analytical skills including ability think feet faced challenging questions sales environment experience managing bid proposal process including responding rfi ability work autonomously effectively dynamic environment strong interpersonal written oral communication skills ability prioritize execute tasks environment preferred qualifications understanding sales process ideally gained within similar environment willing travel short notice situation permits,Director,Full-time,Business Development,Information Technology and Services
