jobTitle,companyName,location,datePosted,appStatus,description,seniorityLevel,employmentType,jobFunction,industries
Sales Director,EnVenture Consulting (亿可咨询),"Beijing, China",2021-08-09,< 25 applicants,job description 1 develop implement strategic account plans order accelerate growth opportunities within assigned accounts 2 develop strong relationships strategic customer accounts beyond procurement support customer satisfaction business development 3 develop detailed sales accordance annual planning cycle 4 set appropriate pricing strategies accordance internal external market dynamics 5 manage develop team commercial direct reports act primary contact key customers internal teams communicate collaborate internal resources ensure key customer needs met monthly special reports analyses necessary ensure care accounts meet budgeted expectations recommend alternate courses action necessary manage develop company marketing materials present customer highlight company strengths requirements education bachelor degree business administration finance sales related field experience 5 years sales experience industries packaging industry plus key customers refer pill box packaging preferred business resources rich resources packaging industry experiences 2 years management experience project management ability establish good relationships key customers strong negotiation leadership skills excellent communication skills fluent oral written english skil,Director,Full-time,,
Sales Manager（国际货运）,海连(中国)国际货运有限公司,"Shanghai, Shanghai, China",2021-09-11,< 25 applicants,monitor manage develop sales team support sales closing clients pipeline 帮助销售促成客户成交 training sales teammates coordinate hr supporting training program retaining valuable team members monitor collection sales controlled clients needed 监督销售客户的及时收款 create visibility towards overseas sales team sharing sales leads frequent basis via sales force review sales performance individual sales monthly quarterly yearly 及年度销售检查和回顾 frequent sales meetings monitoring ensuring sales processes followed results improving ongoing exceed sales team budget完成个人和团队指标 set sales plan target sales align top management sales strategy motivate coach team develop skills 激励和训练团队成员的销售技巧 gather sales pipeline certain volume let pricing work must win rate secure business feedback local market rate air ocean pricing fighting education working experience 教育背景及工作经验 college graduate 大专以上学历 minimum 8 years working experience global forwarders 5 years sales experience 2 years sales management role knowledge ocean air product import export 熟知空海运产品及进出口流程 familiar ms office 熟练掌握办公软件 good communication 良好的沟通能力 good english reading writing 良好的英语读写能力,Director,Full-time,Sales and Business Development,Package/Freight Delivery
Senior Sales Director – China,EnVenture Consulting (亿可咨询),"Shanghai, China",2021-05-09,< 25 applicants,senior sales director main purpose lead direct control sales activities china region ensure organization achieves short sales objectives set corporate business plan summary develops recommends senior management strategies china result maximization sales gm develops recommends senior management business plans operational requirements organizational structure staffing budgets support strategies implements sales strategies approval senior management timely manner deviations strategies parameters established senior management lead direct evaluate develop china sales team ensure business strategy implemented effectively consistently according established guidelines budgets mission market leader retail technology solutions china best sales team country establish execute plans achieve develop rfid across apparel retail market sectors also ensuring current key accounts ready embrace new technology based primary information provide direction product management new product ideas improvements current products develop china sales strategy work product management cmc innovation team deliver required products subsequent sales establish effective relationship sales maximize penetration rfid consumables sales prepare submit approved execute sales plans budgets manner best develop company business accounting variance results work senior management identify opportunities within existing markets new applications within current new markets achieve relevant sales gross profit targets direction control sales personnel contribute towards achievement company operating income cash flow targets direct motivate monitor activity teams conducting regular performance assessment establish system capturing information company able accurately forecast analyze report sales activities within market ensure activities within checkpoint comply relevant acts legal demands ethical standards process administration provide reports comply group china legal requirement ensure compliance annual audits degree business technical field preferably post graduate qualifications mba qualified business commerce marketing sales minimum five years experience within similar role 10 years working experience retail security fmcg industries demonstrable skills effectively building maintaining effective relationships demonstrable skills market development sales strategy budgeting forecasting demonstrated ability deliver significant sales growth specific experiences strong sales background highly developed negotiation communication skills advanced planning analytical skills capacity plan projects work independently limited direction conversant common pc software appl,Director,Full-time,,
Senior Zone Sales Manager,GE Healthcare,"Shanghai, Shanghai, China",2021-09-25,< 25 applicants,job description summary new building senior project manager responsible winning business impacts approaches projects programs functional area affected business organization ways working impacts quality efficiency effectiveness team guided commercial practices policies may shaped role significant commercial priorities moderate autonomy within role enter commercial arrangements high levels commercial judgement required achieve outcomes healthcare leading global medical technology digital solutions innovator mission improve lives moments matter unlock ambition turn ideas realities join organization every voice makes difference every difference builds healthier world job description 角色与职责 基本资格 所需特性 inclusion diversity ge healthcare equal opportunity employer inclusion matters employment decisions made without regard race color religion national ethnic origin sex sexual orientation gender identity expression age disability protected veteran status characteristics protected law expect employees live breathe behaviors act humility build trust lead transparency deliver focus drive ownership always unyielding integrity total rewards designed unlock ambition giving boost flexibility need turn ideas realities salary benefits everything expect organization global strength scale surrounded career opportunities culture fosters care collaboration support vm1 additional information relocation assistance provided,Director,Full-time,Sales,"Hospital & Health Care, Medical Devices, and Pharmaceuticals"
CHINA-Commercial Leader,Linio Group,"Shenzhen, Guangdong, China",2021-09-09,< 25 applicants,job responsibilities develop implement commercial strategies according company goals objectives aiming accelerate growth conduct market research analysis create detailed business plans commercial opportunities expansion business development understand demand local consumers ensure needs met collaborate coordinate diverse teams marketing logistics monitor performance commercial activities using key metrics prepare reports senior management requirements proven managerial experience relevant role proven experience key account servicing understanding market research methods analysis solid knowledge performance reporting commercial awareness partnered strategic mindset excellent organizational leadership skills outstanding communication interpersonal abilities business administration finance relevant field plus fluent must powered jazzhr 8od8j0aixm,Director,Full-time,Management and Manufacturing,"Information Technology and Services, Computer Software, and Internet"
"Sales & Operation Planning,SCM,Export",ManGO Associates,"Jiaxing, Zhejiang, China",2021-07-09,< 25 applicants,individual contributor facilitating sales operation planning process export business plant asia pacific include preparation monthly op deck cross functional input handling communication regarding sales quotation standard product promotion sample requests regulatory check jiaxing plant sales team export business apac managing forecast monitoring forecast accuracy providing deep dive analysis facilitating resolution action plans issues working closely china regional sales jiaxing operation purchase supply chain team coordinating china asia customer service team customer orders internal process supporting business opportunities sales team discovered registering pipeline clear understanding regarding export import procedures ciq logistic process terms requirement destination market participating global transfer projects apac region providing supports localization product launch tracking step status keep update identify potential supply risk take avoid loss customers involving business planning budgeting activities presenting export market qualifications 10 years commercial supply chain experiences asia minimum 5 years experiences sales sales support supply chain operation planning experience international trading business must proven results building strong customer relationships delivering solutions able plan prioritize work meet commitment aligned organizational goals strong business acumen analytical organizational decision making forecasting fluent english communication skills written spoken must background flavor food beverage industry also technical background plus able travel business china asia pacific region experience working se asian countries colleagues pref,Director,Full-time,,
Sales director,Michael Page,"Suzhou, Jiangsu, China",2021-09-18,< 25 applicants,high salary high position client working leading f b products business footprint around world high reputation fmcg industry job description ensure strategies plans defined deliver business growth based consumer shopper customer requirements define priority online offline channels assigned markets create tailored channel business plans define channel targets track actual performance regular basis terms target growth previous periods drive development execution strategic pilot growth projects prioritizing customer activation define number priority customers engaged pilot projects organically liaison field sales team well brand marketing channel sales team focus executing initiatives programs projects timely revenue profit accretive manner successful applicant least 8 years sales marketing sales operations experience business environment involves multiple channel developments beverage wine spirits experience big plus demonstrable record success delivering key commercial kpi understands key business functions commercial marketing finance technical supply chain advanced knowledge trends customer practice market intelligence channel profitability value chain strong leadership team working skills behaviour mature interpersonal communication style bachelor degree equivalent experience preferably business marketing finance excellent verbal written communication skills english skill valued material consideration offer salary resposibility contact natasha jing quote job ref 4176687,Director,Full-time,Sales and Business Development,"Pharmaceuticals, Mental Health Care, and Medical Devices"
"Commercial Director, Shanghai, China",Apex Group Ltd,"Shanghai, Shanghai, China",2021-09-18,< 25 applicants,department commercial employment type permanent job description apex group seeking hire senior professional join established china team based shanghai role originate manage high quality client relationships manner consistent businesses objectives key focus role drive new business greater china increase revenue funds financial corporate services businesses enhancing profile china successful candidate expected understand corporate services local market services experience client relationship function relevant organization attractive salary commission scheme offered successful candidate role key responsibilities drive new client acquisitions increase revenue china achieve business targets implementing new business development initiatives grow business brand reputation across region develop manage strong network clients intermediaries build manage progress pipeline new business opportunities collaborate colleagues globally achieve business objectives lead sales process end end including management deal teams ensure robust knowledge apex offering value proposition champion initiatives across services lines geographies drive news sales existing client base work closely build strong collaborative relationship sales marketing client operations functions advise strategic initiatives product development act key relationship manager ensure clients needs understood communicated organization coach develop motivate sales support professionals drive sales performance achieve sales goals follow internal sales process compliance requirements includes management reporting salesforce maintenance attendance internal meetings assistance onboarding required ensure agreed project deliverables met years experience corporate fund solutions year business development experience ideally hong kong china experience client services relationship management function existing network third party influencers business contacts preferred knowledge financial market including local offshore funds markets strong strategic mind lead contribute discussion type stakeholders various seniority levels demonstrated sales skills ability deliver targets proven experience working senior figures development client relationships strong verbal written mandarin english skills essential experience crm systems internal stakeholders possess strong work ethic well uncompromising integrity educated degree level relevant professional qualifications beneficial attractive compensation scheme directly related performance strategic role development business apac ability originate manage large complex sales opportunities excellent exposure multiple segments financial services industry participants tailored pathway training professional development part dynamic team makes genuine impact revenue sales pipeline exposure aspects business working senior management directly ability contribute strategy drive innovation tangible impact business equal opportunity employer ensure applicant subject less favourable treatment grounds gender gender identity marital status race colour nationality ethnicity age sexual orientation responsibilities dependants physical mental disability hiring decision made basis skills qualifications experiences measure success business delivering great products services continually increasing assets administration market share also positively impact people society planet information commitment corporate social responsibility csr please visit csr policy page looking take next step career ready work high performing organisation alongside talented people take pride delivering great results please submit application cv cover letter salary expectations dedicated email address email protected,Director,Full-time,Business Development and Sales,"Information Technology and Services, Financial Services, and Accounting"
兰州中心套房假日酒店 - 市场销售总监 / Holiday Inn & Suites Lanzhou Center - Director of Sales & Marketing,InterContinental Hotels & Resorts,"Lanzhou, Gansu, China",2021-09-09,< 25 applicants,essential duties responsibilities key activities role produce annual revenue plan marketing budgets forecasts produce action plan related revenue plan ensure revenue plan objectives achieved provides professional advisory support service general manager coordinate methods maintaining increasing business volume includes advertising sales promotion personal selling publicity community relations special sales projects etc create implement special programs achieve greater profitability increasing average rate increasing overall occupancy increasing business volume periods increasing local food beverage banquet sales enhance image hotel local community participate active member community associations memberships trade organizations organize promote cooperation food beverage department special projects stimulate food beverage sales within community including limited tournaments balls parties gastronomic festivities etc interacts individuals outside hotel including limited clients convention bureaus local hotel associations government tourist offices airlines travel agents tour operators competitors members local community review regularly public relations activities ensure high awareness hotel local national media manage development new products services oversee development new marketing strategies conduct market research maintain good communication regional sales marketing personnel implement corporate initiatives works human resources manpower planning management needs works director finance preparation management department budget required qualifications required skills demonstrated ability interact customers employees third parties reflects highly hotel brand company problem solving reasoning motivating organizational training abilities proficient use microsoft office good communication writing skills qualifications bachelor degree sales marketing related field experience 4 years relevant experience similar supervisory role equivalent combination education experience nul,Director,Full-time,Marketing and Sales,Hospitality
Sales Director,每日数字户外 | ChinaDOOH,"Huangpu District, Shanghai, China",2021-06-09,< 25 applicants,1 2 3 4 5 6 3 work demands responsible overall product strategy work digital outdoor advertising automation programmatic platforms including demand analysis function formulation design planning promotion landing optimization according communication customer business department sort customer business process investigate analyze summarize customer needs define product functions working experience related overseas advertising platforms preferred able independently responsible one product directions control product costs grasp status competing products industry real time responsible capacity improvement efficiency advertising platform familiar digital outdoor advertising industry preferred responsible writing requirements documents effectively control costs coordinate promote team complete product development launch monitoring continuous optimization effects collect user opinions continuously sort explore customer needs optimize product business processes functions enhance user experience participate project implementation cooperate completion project launch acceptance assist solving problems encountered project implementation focus experience advertising platform able plan manage product construction perspective advertisers media agencies job requirements bachelor degree computer related majors preferred least 3 years working experience product manager experience commercial advertising platform products preferred fluent spoken written chinese english able meet daily communication overseas teams english preferred working language strong resistance pressure proactively discovering problems solving problems achieving goals possess strong data analysis skills good communication project management skills meticulous thinking logic conduct market research analysis study development status promotion status peers industry conduct regular market forecasts intelligence analysis provide basis company leaders make decisions leadership affinity least 2 years experience leading team strong ability use office software ps software able meet needs domestic overseas business trips 联系职位发布者 rynn zhu chinadooh chief marketing officer 发送 inmail 职位详情 职位性质,Director,Full-time,,
Account Manager/Sales Manager/BD Manager,高新人(大连)品牌管理有限公司,"Shanghai, Shanghai, China",2021-07-09,< 25 applicants,responsibility responsible revenue business growth sales china identify progress market opportunities develop grow strong sales pipeline exceed sales quota develop good relationship customers well maintain enlarge existing business work closely internal cross functional team get necessary support whenever need familiar ito industry experience solution sale account developing 5 sale experience experience manage mnc account plus good term work style working passion,Director,Full-time,Business Development and Sales,Information Technology and Services
E-Marketing & CRM Manager,Coty,"Shanghai, China",2021-09-09,< 25 applicants,responsibility campaign plan 1 work closely marketing ecommerce sales teams develop annual ecommerce calendar new product launch regular campaign support ecommerce sales team achieve sales target 2 lead annual kcp ip campaign plan including double 11 super brand day super fans day etc 3 review campaign plan monthly quarterly annual basis sufficient action plan improve roi whole team sales target 4 ec team yearly live streaming plan driven livestreaming execution business also recruitment content delivery purpose 5 bridge coty gucci china coty china coty global tmall relevant matters communication approval 6 always optimization search traffic solution collaboration gucci tmall visual merchandising 1 work closely sales team layout design improve optimize brand image provide better consumer experience better click rate cvr 2 ecommerce new assets development request proposal connection ec team global team 3 upgrade visual layout based ecommerce calendar including kcp new product launch etc toolkit development global local production house 4 new digital explore tmall keep high competitiveness gucci beauty tmall 5 officialise presence gucci beauty global communication tmall 360 plan responsible approval follow relevant project follow crm work closely internal external partners build big data solutions online offline integrating channels department stores boutiques lead plan implement key crm campaigns line major product campaign meet measurable kpis deliverables star products sampling etc drive key crm kpis new recruitment conversion rate retention rate others work crm lead agencies project planning implementation liaise crm agency wechat content agency develop crm content calendar ensure execution creative benchmark competitors provide insights behaviour bring key competencies driving results knowledge executive disposition excellent communication skill minimum education experience requirements education degree equivalent experience experience 5 years marketing brand marketing experience must minimum knowledge skills abilities required successfully perform major ability understand brand industry knowledge market awareness strategic business goals campaign creation excellent analytical skills good time management attention details keen learn new things creative always try innovative strong analysis planning skills good analytical problem solving skill excellent microsoft office skills excellent oral written communication skills strong interpersonal presentation skills ability work way unstructured environment ability work independently stress excellent english communication years experience crm ecommerce management beauty industry experience advantag,Director,Full-time,Sales,Cosmetics
